{
  "$schema": "https://json-schema.org/draft/2020-12/schema",
  "$id": "https://raw.githubusercontent.com/falsable/a2dlc/main/contracts/selection.schema.json",
  "title": "Occam selection between builders (.a2dlc/run/<slice>/selection.json, N=2)",
  "description": "Written by a2dlc run at the end of Stage 4 when there were two candidates. Each was judged with the other as peer (veredicto_primary.json, veredicto_orthogonal.json). Among those that gave PASS, the one with lower complexity wins, lexicographic: sum of cyclomatic, then sum of ast_nodes, then loc_added + loc_removed; a metric missing from either one is not compared, and the final tie goes to builder_primary. With a single PASS, that one, without measuring complexity. With no PASS, selected is null and the run's outcome is the worse of the two verdicts (FAIL before INCONCLUSIVE). If both fail a test that the other passes, CB-01: selected null and the stage escalates.",
  "type": "object",
  "properties": {
    "schema_version": { "$ref": "defs.schema.json#/$defs/schema_version" },
    "candidates": {
      "type": "array",
      "minItems": 2,
      "maxItems": 2,
      "allOf": [
        { "contains": { "properties": { "builder": { "const": "builder_primary" } } } },
        { "contains": { "properties": { "builder": { "const": "builder_orthogonal" } } } }
      ],
      "items": {
        "type": "object",
        "properties": {
          "builder": { "enum": ["builder_primary", "builder_orthogonal"] },
          "commit": { "$ref": "defs.schema.json#/$defs/git_sha" },
          "verdict": { "$ref": "defs.schema.json#/$defs/verdict" },
          "complexity": {
            "description": "null if it was not measured (not needed, or the verdict is not PASS). Totals over the measured files; unmeasured are the changed files that no engine measured (no engine, or an engine without operation: complexity).",
            "oneOf": [
              { "type": "null" },
              {
                "type": "object",
                "properties": {
                  "loc_added": { "type": "integer", "minimum": 0 },
                  "loc_removed": { "type": "integer", "minimum": 0 },
                  "cyclomatic": { "type": ["integer", "null"], "minimum": 0 },
                  "ast_nodes": { "type": ["integer", "null"], "minimum": 0 },
                  "files": { "type": "array", "items": { "$ref": "engine-complexity-response.schema.json#/$defs/complexity_file" } },
                  "unmeasured": { "type": "array", "items": { "type": "string", "minLength": 1 }, "uniqueItems": true }
                },
                "required": ["loc_added", "loc_removed", "cyclomatic", "ast_nodes", "files", "unmeasured"],
                "additionalProperties": false
              }
            ]
          }
        },
        "required": ["builder", "commit", "verdict", "complexity"],
        "additionalProperties": false
      }
    },
    "selected": { "enum": ["builder_primary", "builder_orthogonal", null] },
    "reason": { "type": "string", "minLength": 1 }
  },
  "required": ["schema_version", "candidates", "selected", "reason"],
  "additionalProperties": false
}
